{
  "event_schema_version": "1.0.0",
  "event_id": "aff34f41-9056-5b71-8353-ee2cafbaceb9",
  "sensor_id": "ot-sensor-01",
  "sensor_boot_id": "7f1c2a9e-4b61-4d7e-9a0c-5c1e2f3a4b5d",
  "sequence": 3,
  "replay_run_id": "20260901T100000Z-fixture",
  "replay_time_offset_us": 864000000000,
  "log_type": "flow_update",
  "event_time": "2026-09-01T10:00:40.000000Z",
  "sensor_emitted_at": "2026-09-11T10:00:40.001500Z",
  "receiver_received_at": "2026-09-11T10:00:40.002400Z",
  "capture_mode": "pcap_replay",
  "observation_coverage": "both_directions",
  "original_record_sha256": "abcbea76e805d5f00eac95abdbea30ddc02c2ca5d0d7576fd202a1c571622f84",
  "original_record": "{\"ts\":1788256840.0,\"uid\":\"CFup0001\",\"id.orig_h\":\"10.10.1.30\",\"id.orig_p\":51000,\"id.resp_h\":\"203.0.113.77\",\"id.resp_p\":443,\"proto\":\"tcp\",\"service\":\"ssl\",\"duration\":10.0,\"orig_bytes\":4500000,\"resp_bytes\":40960,\"orig_pkts\":3100,\"resp_pkts\":1500,\"orig_ip_bytes\":4624000,\"resp_ip_bytes\":100960,\"history\":\"ShADad\",\"snapshot_seq\":2,\"snapshot_interval\":5.0}",
  "original_record_truncated": false,
  "availability": {},
  "availability_reasons": {},
  "payload": {
    "uid": "CFup0001",
    "src_ip": "10.10.1.30",
    "src_port": 51000,
    "dst_ip": "203.0.113.77",
    "dst_port": 443,
    "proto": "tcp",
    "service": "ssl",
    "duration_s": 10.0,
    "orig_bytes": 4500000,
    "resp_bytes": 40960,
    "orig_pkts": 3100,
    "resp_pkts": 1500,
    "orig_ip_bytes": 4624000,
    "resp_ip_bytes": 100960,
    "history": "ShADad",
    "snapshot_seq": 2,
    "snapshot_interval_s": 5.0
  }
}
