{
  "event_schema_version": "1.0.0",
  "event_id": "ff2bc106-ddc5-5974-9530-c6b1419c71e8",
  "sensor_id": "ot-sensor-01",
  "sensor_boot_id": "7f1c2a9e-4b61-4d7e-9a0c-5c1e2f3a4b5d",
  "sequence": 9,
  "replay_run_id": null,
  "replay_time_offset_us": 0,
  "log_type": "dns",
  "event_time": "2026-09-01T10:00:07.000000Z",
  "sensor_emitted_at": "2026-09-01T10:00:07.001500Z",
  "receiver_received_at": "2026-09-01T10:00:07.002400Z",
  "capture_mode": "synthetic_log",
  "observation_coverage": "both_directions",
  "original_record_sha256": "78852fe8997a2f0e85001ca1444ca7e3e2ef20c70b1f50ea6d4b16a063255615",
  "original_record": "{\"ts\":1788256807.0,\"uid\":\"CSyn0001\",\"id.orig_h\":\"10.10.1.40\",\"id.orig_p\":53211,\"id.resp_h\":\"10.10.0.53\",\"id.resp_p\":53,\"proto\":\"udp\",\"trans_id\":4242,\"rtt\":0.004,\"query\":\"xjwqkzvbplrtd.com\",\"qclass\":1,\"qtype\":1,\"qtype_name\":\"A\",\"rcode\":3,\"rcode_name\":\"NXDOMAIN\",\"AA\":false,\"TC\":false,\"RD\":true,\"RA\":true,\"Z\":0,\"rejected\":false}",
  "original_record_truncated": false,
  "availability": {},
  "availability_reasons": {},
  "payload": {
    "uid": "CSyn0001",
    "src_ip": "10.10.1.40",
    "src_port": 53211,
    "dst_ip": "10.10.0.53",
    "dst_port": 53,
    "proto": "udp",
    "trans_id": 4242,
    "rtt_s": 0.004,
    "query": "xjwqkzvbplrtd.com",
    "query_truncated": false,
    "qclass": 1,
    "qtype": 1,
    "qtype_name": "A",
    "rcode": 3,
    "rcode_name": "NXDOMAIN",
    "aa": false,
    "tc": false,
    "rd": true,
    "ra": true,
    "answers": [],
    "answers_truncated": false,
    "rejected": false
  }
}
