{
  "event_schema_version": "1.0.0",
  "event_id": "ebd0d984-73e6-53e9-ac0a-e5696df6d338",
  "sensor_id": "ot-sensor-01",
  "sensor_boot_id": "7f1c2a9e-4b61-4d7e-9a0c-5c1e2f3a4b5d",
  "sequence": 5,
  "replay_run_id": "20260901T100000Z-fixture",
  "replay_time_offset_us": 864000000000,
  "log_type": "dns",
  "event_time": "2026-09-01T10:00:03.000000Z",
  "sensor_emitted_at": "2026-09-11T10:00:03.001500Z",
  "receiver_received_at": "2026-09-11T10:00:03.002400Z",
  "capture_mode": "pcap_replay",
  "observation_coverage": "both_directions",
  "original_record_sha256": "0838ec88ca1361a357cfdcd0a615a1466370946e8a93d8a76b1cee743020b311",
  "original_record": "{\"ts\":1788256803.0,\"uid\":\"CDn0002\",\"id.orig_h\":\"10.10.1.40\",\"id.orig_p\":53211,\"id.resp_h\":\"10.10.0.53\",\"id.resp_p\":53,\"proto\":\"udp\",\"trans_id\":4242,\"query\":\"historian-01.plant.local\",\"qclass\":1,\"qtype\":1,\"qtype_name\":\"A\",\"AA\":false,\"TC\":false,\"RD\":true,\"RA\":false,\"Z\":0,\"rejected\":false}",
  "original_record_truncated": false,
  "availability": {
    "rtt_s": "MISSING",
    "rcode": "MISSING",
    "rcode_name": "MISSING",
    "answers": "MISSING"
  },
  "availability_reasons": {
    "rtt_s": "no_response_observed",
    "rcode": "no_response_observed",
    "rcode_name": "no_response_observed",
    "answers": "no_response_observed"
  },
  "payload": {
    "uid": "CDn0002",
    "src_ip": "10.10.1.40",
    "src_port": 53211,
    "dst_ip": "10.10.0.53",
    "dst_port": 53,
    "proto": "udp",
    "trans_id": 4242,
    "rtt_s": null,
    "query": "historian-01.plant.local",
    "query_truncated": false,
    "qclass": 1,
    "qtype": 1,
    "qtype_name": "A",
    "rcode": null,
    "rcode_name": null,
    "aa": false,
    "tc": false,
    "rd": true,
    "ra": false,
    "answers": null,
    "answers_truncated": false,
    "rejected": false
  }
}
