{
  "event_schema_version": "1.0.0",
  "event_id": "d314c5ee-2d50-56fe-a2ea-6424be89cf44",
  "sensor_id": "ot-sensor-01",
  "sensor_boot_id": "7f1c2a9e-4b61-4d7e-9a0c-5c1e2f3a4b5d",
  "sequence": 4,
  "replay_run_id": "20260901T100000Z-fixture",
  "replay_time_offset_us": 864000000000,
  "log_type": "dns",
  "event_time": "2026-09-01T10:00:02.000000Z",
  "sensor_emitted_at": "2026-09-11T10:00:02.001500Z",
  "receiver_received_at": "2026-09-11T10:00:02.002400Z",
  "capture_mode": "pcap_replay",
  "observation_coverage": "both_directions",
  "original_record_sha256": "80292a54302e17a2b58fa96d50d964373b014c5088a53886b7a9e0034a5c59a3",
  "original_record": "{\"ts\":1788256802.0,\"uid\":\"CDn0001\",\"id.orig_h\":\"10.10.1.40\",\"id.orig_p\":53211,\"id.resp_h\":\"10.10.0.53\",\"id.resp_p\":53,\"proto\":\"udp\",\"trans_id\":4242,\"rtt\":0.004,\"query\":\"xjwqkzvbplrtd.com\",\"qclass\":1,\"qtype\":1,\"qtype_name\":\"A\",\"rcode\":3,\"rcode_name\":\"NXDOMAIN\",\"AA\":false,\"TC\":false,\"RD\":true,\"RA\":true,\"Z\":0,\"rejected\":false}",
  "original_record_truncated": false,
  "availability": {},
  "availability_reasons": {},
  "payload": {
    "uid": "CDn0001",
    "src_ip": "10.10.1.40",
    "src_port": 53211,
    "dst_ip": "10.10.0.53",
    "dst_port": 53,
    "proto": "udp",
    "trans_id": 4242,
    "rtt_s": 0.004,
    "query": "xjwqkzvbplrtd.com",
    "query_truncated": false,
    "qclass": 1,
    "qtype": 1,
    "qtype_name": "A",
    "rcode": 3,
    "rcode_name": "NXDOMAIN",
    "aa": false,
    "tc": false,
    "rd": true,
    "ra": true,
    "answers": [],
    "answers_truncated": false,
    "rejected": false
  }
}
