{
  "event_schema_version": "1.0.0",
  "event_id": "975e2bda-2dd4-5e4c-a2f1-a62173ed4764",
  "sensor_id": "ot-sensor-01",
  "sensor_boot_id": "7f1c2a9e-4b61-4d7e-9a0c-5c1e2f3a4b5d",
  "sequence": 7,
  "replay_run_id": "20260901T100000Z-fixture",
  "replay_time_offset_us": 864000000000,
  "log_type": "weird",
  "event_time": "2026-09-01T10:00:05.000000Z",
  "sensor_emitted_at": "2026-09-11T10:00:05.001500Z",
  "receiver_received_at": "2026-09-11T10:00:05.002400Z",
  "capture_mode": "pcap_replay",
  "observation_coverage": "both_directions",
  "original_record_sha256": "e71a387aa3149995097259b199341aad69539ee0b5a548ec06d6830f7a20e2fc",
  "original_record": "{\"ts\":1788256805.0,\"name\":\"truncated_IPv6\",\"notice\":false,\"peer\":\"zeek\"}",
  "original_record_truncated": false,
  "availability": {
    "uid": "NOT_APPLICABLE",
    "src_ip": "NOT_APPLICABLE",
    "src_port": "NOT_APPLICABLE",
    "dst_ip": "NOT_APPLICABLE",
    "dst_port": "NOT_APPLICABLE",
    "addl": "NOT_APPLICABLE",
    "source": "NOT_APPLICABLE"
  },
  "availability_reasons": {
    "uid": "not_connection_scoped",
    "src_ip": "not_connection_scoped",
    "src_port": "not_connection_scoped",
    "dst_ip": "not_connection_scoped",
    "dst_port": "not_connection_scoped",
    "addl": "no_additional_info",
    "source": "zeek_field_absent"
  },
  "payload": {
    "uid": null,
    "src_ip": null,
    "src_port": null,
    "dst_ip": null,
    "dst_port": null,
    "name": "truncated_IPv6",
    "addl": null,
    "notice": false,
    "peer": "zeek",
    "source": null
  }
}
