{
  "event_schema_version": "1.0.0",
  "event_id": "f83271e5-384d-55d4-8216-6e01a106bc38",
  "sensor_id": "ot-sensor-01",
  "sensor_boot_id": "7f1c2a9e-4b61-4d7e-9a0c-5c1e2f3a4b5d",
  "sequence": 8,
  "replay_run_id": "20260901T100000Z-fixture",
  "replay_time_offset_us": 864000000000,
  "log_type": "conn",
  "event_time": "2026-09-01T10:00:06.000000Z",
  "sensor_emitted_at": "2026-09-11T10:00:06.001500Z",
  "receiver_received_at": "2026-09-11T10:00:06.002400Z",
  "capture_mode": "pcap_replay",
  "observation_coverage": "both_directions",
  "original_record_sha256": "fd3e93f79b67b11c7daa50809b4179881d96bf0cf4f0834e141e68e87cc6c36b",
  "original_record": null,
  "original_record_truncated": true,
  "availability": {},
  "availability_reasons": {},
  "payload": {
    "uid": "CBig0001",
    "src_ip": "10.10.1.10",
    "src_port": 49152,
    "dst_ip": "10.10.2.5",
    "dst_port": 502,
    "proto": "tcp",
    "service": "modbus",
    "duration_s": 0.021345,
    "orig_bytes": 12,
    "resp_bytes": 11,
    "orig_pkts": 6,
    "resp_pkts": 4,
    "orig_ip_bytes": 332,
    "resp_ip_bytes": 223,
    "history": "ShADadFf",
    "missed_bytes": 0,
    "conn_state": "SF",
    "local_orig": true,
    "local_resp": true
  }
}
