{
  "event_schema_version": "1.0.0",
  "event_id": "d96ccac2-75f8-5071-be58-abac6b061e5e",
  "sensor_id": "ot-sensor-01",
  "sensor_boot_id": "7f1c2a9e-4b61-4d7e-9a0c-5c1e2f3a4b5d",
  "sequence": 0,
  "replay_run_id": "20260901T100000Z-fixture",
  "replay_time_offset_us": 864000000000,
  "log_type": "conn",
  "event_time": "2026-09-01T10:00:00.123456Z",
  "sensor_emitted_at": "2026-09-11T10:00:00.124956Z",
  "receiver_received_at": "2026-09-11T10:00:00.125856Z",
  "capture_mode": "pcap_replay",
  "observation_coverage": "both_directions",
  "original_record_sha256": "86a8fcee2e0e18a75b0f9596272a0d00386fcee1dbb37e410b0bd5dcd5ef59f7",
  "original_record": "{\"ts\":1788256800.123456,\"uid\":\"CMb1a2b3c4d5e6f7g8\",\"id.orig_h\":\"10.10.1.10\",\"id.orig_p\":49152,\"id.resp_h\":\"10.10.2.5\",\"id.resp_p\":502,\"proto\":\"tcp\",\"service\":\"modbus\",\"duration\":0.021345,\"orig_bytes\":12,\"resp_bytes\":11,\"conn_state\":\"SF\",\"local_orig\":true,\"local_resp\":true,\"missed_bytes\":0,\"history\":\"ShADadFf\",\"orig_pkts\":6,\"orig_ip_bytes\":332,\"resp_pkts\":4,\"resp_ip_bytes\":223}",
  "original_record_truncated": false,
  "availability": {},
  "availability_reasons": {},
  "payload": {
    "uid": "CMb1a2b3c4d5e6f7g8",
    "src_ip": "10.10.1.10",
    "src_port": 49152,
    "dst_ip": "10.10.2.5",
    "dst_port": 502,
    "proto": "tcp",
    "service": "modbus",
    "duration_s": 0.021345,
    "orig_bytes": 12,
    "resp_bytes": 11,
    "orig_pkts": 6,
    "resp_pkts": 4,
    "orig_ip_bytes": 332,
    "resp_ip_bytes": 223,
    "history": "ShADadFf",
    "missed_bytes": 0,
    "conn_state": "SF",
    "local_orig": true,
    "local_resp": true
  }
}
